{
  "schema_version": "epic-plan.v1",
  "plan_id": "EPIC-PLAN-0042",
  "source": {
    "repository": "TOSS-Soft/toss-cli",
    "revision": "feature-request@42",
    "sha256": "aaaaaaaaaaaaaaaaaaaaaaaaaaaaaaaaaaaaaaaaaaaaaaaaaaaaaaaaaaaaaaaa"
  },
  "epic": {
    "schema_version": "work-item.v1",
    "id": "TOSS-Soft/toss-cli#42",
    "repository": "TOSS-Soft/toss-cli",
    "issue_number": 42,
    "kind": "epic",
    "parent_id": null,
    "branch": "epic/42-organizational-lifecycle",
    "base_branch": null,
    "milestone": null,
    "status": "Backlog",
    "gate": "EPIC_PREPARATION_REQUIRED"
  },
  "children": [
    {
      "schema_version": "work-item.v1",
      "id": "TOSS-Soft/toss-cli#43",
      "repository": "TOSS-Soft/toss-cli",
      "issue_number": 43,
      "kind": "issue",
      "parent_id": "TOSS-Soft/toss-cli#42",
      "acceptance_criteria": [
        "The dependency graph is validated before work begins."
      ],
      "branch": "issue/43-validate-dependencies",
      "base_branch": "epic/42-organizational-lifecycle",
      "milestone": null,
      "status": "Backlog",
      "gate": "RELEASE_PLANNING"
    },
    {
      "schema_version": "work-item.v1",
      "id": "TOSS-Soft/toss-cli#44",
      "repository": "TOSS-Soft/toss-cli",
      "issue_number": 44,
      "kind": "issue",
      "parent_id": "TOSS-Soft/toss-cli#42",
      "acceptance_criteria": [
        "Native epic children are reconciled idempotently."
      ],
      "branch": "issue/44-reconcile-native-children",
      "base_branch": "epic/42-organizational-lifecycle",
      "milestone": null,
      "status": "Backlog",
      "gate": "RELEASE_PLANNING"
    }
  ],
  "edges": [
    {
      "schema_version": "dependency-edge.v1",
      "edge_id": "DEP-0044-0043",
      "source": "TOSS-Soft/toss-cli#44",
      "target": "TOSS-Soft/toss-cli#43",
      "kind": "requires",
      "rationale": "Child reconciliation consumes the validated dependency graph.",
      "provenance": {
        "source_revision": "feature-request@42",
        "source_sha256": "aaaaaaaaaaaaaaaaaaaaaaaaaaaaaaaaaaaaaaaaaaaaaaaaaaaaaaaaaaaaaaaa",
        "locations": [
          "dependencies[0]"
        ]
      },
      "revision": "EDGE-0044-0043@1"
    }
  ],
  "content_sha256": "e78ceb47ad3409164bb656fdb5c589b6faafd1c1424b7511d8273065ba9f793a",
  "created_at": "2026-09-01T10:00:00.000Z"
}
