{
  "schema_version": "epic-plan.v1",
  "plan_id": "EPIC-PLAN-CYCLE-0042",
  "source": {
    "repository": "TOSS-Soft/toss-cli",
    "revision": "feature-request@cycle",
    "sha256": "bbbbbbbbbbbbbbbbbbbbbbbbbbbbbbbbbbbbbbbbbbbbbbbbbbbbbbbbbbbbbbbb"
  },
  "epic": {
    "schema_version": "work-item.v1",
    "id": "TOSS-Soft/toss-cli#42",
    "repository": "TOSS-Soft/toss-cli",
    "issue_number": 42,
    "kind": "epic",
    "parent_id": null,
    "branch": "epic/42-organizational-lifecycle",
    "base_branch": null,
    "milestone": null,
    "status": "Backlog",
    "gate": "EPIC_PREPARATION_REQUIRED"
  },
  "children": [
    {
      "schema_version": "work-item.v1",
      "id": "TOSS-Soft/toss-cli#43",
      "repository": "TOSS-Soft/toss-cli",
      "issue_number": 43,
      "kind": "issue",
      "parent_id": "TOSS-Soft/toss-cli#42",
      "acceptance_criteria": [
        "First cycle node."
      ],
      "branch": "issue/43-first-cycle-node",
      "base_branch": "epic/42-organizational-lifecycle",
      "milestone": null,
      "status": "Backlog",
      "gate": "RELEASE_PLANNING"
    },
    {
      "schema_version": "work-item.v1",
      "id": "TOSS-Soft/toss-cli#44",
      "repository": "TOSS-Soft/toss-cli",
      "issue_number": 44,
      "kind": "issue",
      "parent_id": "TOSS-Soft/toss-cli#42",
      "acceptance_criteria": [
        "Second cycle node."
      ],
      "branch": "issue/44-second-cycle-node",
      "base_branch": "epic/42-organizational-lifecycle",
      "milestone": null,
      "status": "Backlog",
      "gate": "RELEASE_PLANNING"
    }
  ],
  "edges": [
    {
      "schema_version": "dependency-edge.v1",
      "edge_id": "DEP-CYCLE-A",
      "source": "TOSS-Soft/toss-cli#43",
      "target": "TOSS-Soft/toss-cli#44",
      "kind": "requires",
      "rationale": "First child waits for the second child.",
      "provenance": {
        "source_revision": "feature-request@cycle",
        "source_sha256": "bbbbbbbbbbbbbbbbbbbbbbbbbbbbbbbbbbbbbbbbbbbbbbbbbbbbbbbbbbbbbbbb",
        "locations": [
          "dependencies[0]"
        ]
      },
      "revision": "EDGE-CYCLE-A@1"
    },
    {
      "schema_version": "dependency-edge.v1",
      "edge_id": "DEP-CYCLE-B",
      "source": "TOSS-Soft/toss-cli#44",
      "target": "TOSS-Soft/toss-cli#43",
      "kind": "requires",
      "rationale": "Second child waits for the first child.",
      "provenance": {
        "source_revision": "feature-request@cycle",
        "source_sha256": "bbbbbbbbbbbbbbbbbbbbbbbbbbbbbbbbbbbbbbbbbbbbbbbbbbbbbbbbbbbbbbbb",
        "locations": [
          "dependencies[1]"
        ]
      },
      "revision": "EDGE-CYCLE-B@1"
    }
  ],
  "content_sha256": "2dd94aa260ce23cec92624b47dac16fccd6dac218d199f975355f9804cd50e2d",
  "created_at": "2026-09-01T10:05:00.000Z"
}
